{
  "schema": "statedd.browser_verification.v1",
  "captured_at": "2026-06-23T12:34:56+02:00",
  "provider": {
    "kind": "manual_browser",
    "required": false,
    "available": true,
    "selection_reason": "no automation provider available; human captured browser evidence",
    "fallbacks_considered": [
      "kimi_webbridge",
      "playwright"
    ]
  },
  "runtime_identity": {
    "path": "runtime_identity.json",
    "head_matches": true,
    "endpoint_matches": true
  },
  "checks": [
    {
      "id": "BV1",
      "route": "/settings",
      "claim": "Settings page renders after saving profile changes.",
      "status": "passed",
      "evidence": [
        "screenshots/settings-after-save.png"
      ],
      "known_limits": []
    }
  ],
  "artifacts": [
    {
      "path": "screenshots/settings-after-save.png",
      "kind": "screenshot",
      "sha256": null,
      "redaction_status": "manual_required"
    }
  ],
  "limits": [
    "Manual browser verification was used because no browser automation provider was available."
  ]
}
